[
  {
    "missionId": "mission-vertical-reading-001",
    "missionType": "vertical-reading",
    "targetIds": ["word-cat"],
    "prompt": "たてに よんで「ねこ」を さがそう",
    "choices": ["ねこ", "いぬ", "くま"],
    "correctAnswer": "ねこ",
    "difficulty": 1,
    "orientation": "vertical",
    "reward": {
      "experience": 10,
      "gold": 5
    },
    "unlockCondition": null,
    "active": true
  },
  {
    "missionId": "mission-vertical-reading-002",
    "missionType": "vertical-reading",
    "targetIds": ["word-moon"],
    "prompt": "たてに よんで「つき」を さがそう",
    "choices": ["つき", "ゆき", "ほし"],
    "correctAnswer": "つき",
    "difficulty": 2,
    "orientation": "vertical",
    "reward": {
      "experience": 10,
      "gold": 5
    },
    "unlockCondition": null,
    "active": true
  }
]
