[
  {
    "missionId": "mission-horizontal-reading-001",
    "missionType": "horizontal-reading",
    "targetIds": ["word-sea"],
    "prompt": "よこに よんで「うみ」を さがそう",
    "choices": ["うみ", "やま", "かわ"],
    "correctAnswer": "うみ",
    "difficulty": 1,
    "orientation": "horizontal",
    "reward": {
      "experience": 10,
      "gold": 5
    },
    "unlockCondition": null,
    "active": true
  },
  {
    "missionId": "mission-horizontal-reading-002",
    "missionType": "horizontal-reading",
    "targetIds": ["word-sky"],
    "prompt": "よこに よんで「そら」を さがそう",
    "choices": ["そら", "ほし", "あめ"],
    "correctAnswer": "そら",
    "difficulty": 2,
    "orientation": "horizontal",
    "reward": {
      "experience": 10,
      "gold": 5
    },
    "unlockCondition": null,
    "active": true
  }
]
