[
  {
    "missionId": "mission-letter-introduction-001",
    "missionType": "letter-introduction",
    "targetIds": ["hiragana-a"],
    "prompt": "「あ」を みよう",
    "choices": ["あ", "お"],
    "correctAnswer": "あ",
    "difficulty": 1,
    "orientation": "horizontal",
    "reward": {
      "experience": 10,
      "gold": 5
    },
    "unlockCondition": null,
    "active": true
  },
  {
    "missionId": "mission-letter-introduction-002",
    "missionType": "letter-introduction",
    "targetIds": ["katakana-a"],
    "prompt": "「ア」を みよう",
    "choices": ["ア", "オ"],
    "correctAnswer": "ア",
    "difficulty": 2,
    "orientation": "horizontal",
    "reward": {
      "experience": 10,
      "gold": 5
    },
    "unlockCondition": null,
    "active": true
  }
]
