[
  {
    "missionId": "mission-letter-search-001",
    "missionType": "letter-search",
    "targetIds": ["hiragana-a"],
    "prompt": "「あ」を みつけよう",
    "choices": ["あ", "い", "う", "え"],
    "correctAnswer": "あ",
    "difficulty": 1,
    "orientation": "horizontal",
    "reward": {
      "experience": 10,
      "gold": 5
    },
    "unlockCondition": null,
    "active": true
  },
  {
    "missionId": "mission-letter-search-002",
    "missionType": "letter-search",
    "targetIds": ["hiragana-ne"],
    "prompt": "「ね」を みつけよう",
    "choices": ["ね", "れ", "わ", "め"],
    "correctAnswer": "ね",
    "difficulty": 2,
    "orientation": "horizontal",
    "reward": {
      "experience": 10,
      "gold": 5
    },
    "unlockCondition": null,
    "active": true
  }
]
