[
  {
    "missionId": "mission-word-completion-001",
    "missionType": "word-completion",
    "targetIds": ["word-cat"],
    "prompt": "ね□ に 入る もじ",
    "choices": ["こ", "け", "に", "た"],
    "correctAnswer": "こ",
    "difficulty": 1,
    "orientation": "horizontal",
    "reward": {
      "experience": 10,
      "gold": 5
    },
    "unlockCondition": null,
    "active": true
  },
  {
    "missionId": "mission-word-completion-002",
    "missionType": "word-completion",
    "targetIds": ["word-flower"],
    "prompt": "は□ に 入る もじ",
    "choices": ["な", "ま", "ほ", "ね"],
    "correctAnswer": "な",
    "difficulty": 2,
    "orientation": "horizontal",
    "reward": {
      "experience": 10,
      "gold": 5
    },
    "unlockCondition": null,
    "active": true
  }
]
