[
  {
    "missionId": "mission-word-ordering-001",
    "missionType": "word-ordering",
    "targetIds": ["word-dog"],
    "prompt": "ならべて「いぬ」を つくろう",
    "choices": ["いぬ", "ぬい", "い"],
    "correctAnswer": "いぬ",
    "difficulty": 1,
    "orientation": "horizontal",
    "reward": {
      "experience": 10,
      "gold": 5
    },
    "unlockCondition": null,
    "active": true
  },
  {
    "missionId": "mission-word-ordering-002",
    "missionType": "word-ordering",
    "targetIds": ["word-bus"],
    "prompt": "ならべて「バス」を つくろう",
    "choices": ["バス", "スバ", "バ"],
    "correctAnswer": "バス",
    "difficulty": 2,
    "orientation": "horizontal",
    "reward": {
      "experience": 10,
      "gold": 5
    },
    "unlockCondition": null,
    "active": true
  }
]
